{
  "schemaVersion": "1.0.0",
  "producer": "azure-portal-facilitator-export",
  "capturedAt": "2026-08-20T14:45:00Z",
  "capturedByPrincipalId": "00000000-0000-0000-0000-000000000013",
  "portalUri": "https://portal.azure.com/#view/Microsoft_Azure_SRE/ResponsePlan",
  "agentResourceId": "/subscriptions/00000000-0000-0000-0000-000000000000/resourceGroups/rg-sre-example/providers/Microsoft.App/agents/sre-catalog-example",
  "agentApplicationInsightsResourceId": "/subscriptions/00000000-0000-0000-0000-000000000000/resourceGroups/rg-sre-example/providers/Microsoft.Insights/components/appi-sre-example",
  "plan": {
    "platform": "AzureMonitor",
    "name": "catalog-reviewed-rollback",
    "autonomyMode": "Review",
    "quickstartPlanEnabled": false,
    "participantApprovalAllowed": false,
    "reviewProposalObserved": true
  },
  "testIncident": {
    "id": "sre-preflight-0001",
    "alertId": "/subscriptions/00000000-0000-0000-0000-000000000000/providers/Microsoft.AlertsManagement/alerts/00000000-0000-0000-0000-000000000203",
    "threadId": "thread-sre-preflight-0001",
    "traceId": "00000000000000000000000000000002",
    "correlationId": "00000000-0000-0000-0000-000000000204",
    "testStart": "2026-08-20T14:39:00Z",
    "deliveredAt": "2026-08-20T14:40:00Z",
    "reviewedAt": "2026-08-20T14:42:00Z",
    "testEnd": "2026-08-20T14:43:00Z",
    "decision": "Rejected",
    "reviewedByPrincipalId": "00000000-0000-0000-0000-000000000013",
    "writeExecuted": false
  },
  "audit": {
    "request": {
      "method": "POST",
      "url": "/subscriptions/00000000-0000-0000-0000-000000000000/resourceGroups/rg-sre-example/providers/Microsoft.Insights/components/appi-sre-example/query?api-version=2018-04-20",
      "query": "customEvents\n| where timestamp between (datetime(2026-08-20T14:39:00Z) .. datetime(2026-08-20T14:43:00Z))\n| where name in (\"IncidentActivitySnapshot\", \"AgentResponse\", \"ApprovalDecision\")\n| extend AgentId = tostring(customDimensions[\"gen_ai.agent.id\"]), AgentName = tostring(customDimensions[\"gen_ai.agent.name\"]), TraceId = tostring(customDimensions[\"TraceId\"]), SpanId = tostring(customDimensions[\"SpanId\"]), ParentSpanId = tostring(customDimensions[\"ParentSpanId\"]), ThreadId = tostring(customDimensions[\"ThreadId\"]), CorrelationId = tostring(customDimensions[\"CorrelationId\"]), LogTimestamp = tostring(customDimensions[\"LogTimestamp\"])\n| where AgentId == \"/subscriptions/00000000-0000-0000-0000-000000000000/resourceGroups/rg-sre-example/providers/Microsoft.App/agents/sre-catalog-example\" and ThreadId == \"thread-sre-preflight-0001\"\n| project timestamp, name, AgentId, AgentName, TraceId, SpanId, ParentSpanId, ThreadId, CorrelationId, LogTimestamp, Properties = customDimensions\n| order by timestamp asc"
    },
    "response": {
      "tables": [
        {
          "name": "PrimaryResult",
          "columns": [
            {
              "name": "timestamp",
              "type": "datetime"
            },
            {
              "name": "name",
              "type": "string"
            },
            {
              "name": "AgentId",
              "type": "string"
            },
            {
              "name": "AgentName",
              "type": "string"
            },
            {
              "name": "TraceId",
              "type": "string"
            },
            {
              "name": "SpanId",
              "type": "string"
            },
            {
              "name": "ParentSpanId",
              "type": "string"
            },
            {
              "name": "ThreadId",
              "type": "string"
            },
            {
              "name": "CorrelationId",
              "type": "string"
            },
            {
              "name": "LogTimestamp",
              "type": "string"
            },
            {
              "name": "Properties",
              "type": "dynamic"
            }
          ],
          "rows": [
            [
              "2026-08-20T14:40:00Z",
              "IncidentActivitySnapshot",
              "/subscriptions/00000000-0000-0000-0000-000000000000/resourceGroups/rg-sre-example/providers/Microsoft.App/agents/sre-catalog-example",
              "sre-catalog-example",
              "00000000000000000000000000000002",
              "0000000000000011",
              "0000000000000000",
              "thread-sre-preflight-0001",
              "00000000-0000-0000-0000-000000000204",
              "2026-08-20T14:40:00Z",
              {
                "alertId": "/subscriptions/00000000-0000-0000-0000-000000000000/providers/Microsoft.AlertsManagement/alerts/00000000-0000-0000-0000-000000000203",
                "testIncidentId": "sre-preflight-0001"
              }
            ],
            [
              "2026-08-20T14:40:20Z",
              "AgentResponse",
              "/subscriptions/00000000-0000-0000-0000-000000000000/resourceGroups/rg-sre-example/providers/Microsoft.App/agents/sre-catalog-example",
              "sre-catalog-example",
              "00000000000000000000000000000002",
              "0000000000000012",
              "0000000000000011",
              "thread-sre-preflight-0001",
              "00000000-0000-0000-0000-000000000204",
              "2026-08-20T14:40:20Z",
              {
                "reviewRequired": true,
                "writeRequested": false
              }
            ],
            [
              "2026-08-20T14:42:00Z",
              "ApprovalDecision",
              "/subscriptions/00000000-0000-0000-0000-000000000000/resourceGroups/rg-sre-example/providers/Microsoft.App/agents/sre-catalog-example",
              "sre-catalog-example",
              "00000000000000000000000000000002",
              "0000000000000013",
              "0000000000000012",
              "thread-sre-preflight-0001",
              "00000000-0000-0000-0000-000000000204",
              "2026-08-20T14:42:00Z",
              {
                "decision": "Rejected",
                "reviewedByPrincipalId": "00000000-0000-0000-0000-000000000013",
                "writeExecuted": false
              }
            ]
          ]
        }
      ]
    }
  }
}
